<?xml version="1.0" encoding="utf-8"?>
<pane xmlns:xi="http://www.w3.org/2001/XInclude" xmlns:xsi="http://www.w3.org/2001/XMLSchema-instance" xsi:noNamespaceSchemaLocation="http://jmri.org/xml/schema/programmer.xsd">
  <name>Basic</name>
  <name xml:lang="ca">Bàsic</name>
  <name xml:lang="it">Basic</name>
  <name xml:lang="de">Basic</name>
  <column>
    <dccaddress/>
    <label>
      <text> </text>
    </label>
    <display item="Short Address" tooltip="Sets the primary (short) address">
      <tooltip xml:lang="it">Indirizzo Corto"</tooltip>
      <tooltip xml:lang="ca">Establir adreÁa prim‡ria (short)</tooltip>
      <tooltip xml:lang="de">Sets the primary (short) address</tooltip>
    </display>
    <display item="Long Address" tooltip="Sets the extended (long) address">
      <tooltip xml:lang="it">Imposta l'indirizzo esteso</tooltip>
      <tooltip xml:lang="ca">Establir adreÁa llarga</tooltip>
      <tooltip xml:lang="de">Sets the extended (long) address</tooltip>
    </display>
    <display item="Address Format" tooltip="Determines whether loco will use short or long address">
      <tooltip xml:lang="it">Determina se la Loco usa l'indirizzo corto o quello esteso</tooltip>
      <tooltip xml:lang="ca">Determina si es fa servir adreÁa curta o llargaî</tooltip>
      <tooltip xml:lang="de">Determines whether loco will use short or long address</tooltip>
    </display>
    <label>
      <text> </text>
    </label>
    <display item="Locomotive Direction" tooltip="Sets the relative direction of the loco when told to move forward">
      <tooltip xml:lang="it">Imposta la Direzione di movimento della Loco per Comando Avanti</tooltip>
      <tooltip xml:lang="ca">Estableix el sentit de circulaciÛ de la locomotora</tooltip>
      <tooltip xml:lang="de">Sets the relative direction of the loco when told to move forward</tooltip>
    </display>
    <display item="Speed Step Mode" tooltip="Sets the speed step mode for headlight control">
      <tooltip xml:lang="it">Imposta gli Step Velocità di default per Comando Luci</tooltip>
      <tooltip xml:lang="ca">Estableix els passos de velocitat per al control de llums</tooltip>
      <tooltip xml:lang="de">Sets the speed step mode for headlight control</tooltip>
    </display>
    <display item="Analog (DC) Operation" tooltip="Determines whether loco can operate on conventional DC current (enables Power Source Conversion)">
      <tooltip xml:lang="it">Determina se la Loco può operare in DC (analogica)</tooltip>
      <tooltip xml:lang="ca">Estableix que la locomotora pot circular en analÚgic [CC] (ConversiÛ de Font de potËncia)</tooltip>
      <tooltip xml:lang="de">Determines whether loco can operate on conventional DC current (enables Power Source Conversion)</tooltip>
    </display>
  </column>
  <column>
    <label>
      <text> </text>
    </label>
    <label>
      <text> </text>
    </label>
    <display item="User Id #1" tooltip="Sets a custom user ID or number">
      <tooltip xml:lang="it">Imposta un ID Utente o un Codice</tooltip>
      <tooltip xml:lang="ca">1r n˙mero usuari</tooltip>
      <tooltip xml:lang="de">Sets a custom user ID or number</tooltip>
    </display>
    <display item="User Id #2" tooltip="Sets a custom user ID or number">
      <tooltip xml:lang="it">Imposta un ID Utente o un Codice</tooltip>
      <tooltip xml:lang="ca">2n n˙mero usuari</tooltip>
      <tooltip xml:lang="de">Sets a custom user ID or number</tooltip>
    </display>
    <label>
      <text> </text>
    </label>
    <separator/>
    <label>
      <text> </text>
    </label>
    <display item="Manufacturer" tooltip="The manufacturer's ID number (read only)">
      <tooltip xml:lang="it">ID Costruttore (sola lettura)</tooltip>
      <tooltip xml:lang="ca">N˙mero de fabricant (nomÈs lectura)</tooltip>
      <tooltip xml:lang="de">The manufacturer's ID number (read only)</tooltip>
    </display>
    <display item="Decoder Version" tooltip="The decoder version number (read only)">
      <tooltip xml:lang="it">Numero versione del Decoder (sola lettura)</tooltip>
      <tooltip xml:lang="ca">N˙mero de versiÛ del descodificador (nomÈs lectura)</tooltip>
      <tooltip xml:lang="de">The decoder version number (read only)</tooltip>
    </display>
    <display item="Product Number" tooltip="The decoder product number (if used) (read only)">
      <tooltip xml:lang="it">Codice di prodotto del Decoder (se usato) (sola lettura)</tooltip>
      <tooltip xml:lang="ca">La referËncia del descodificador (nomÈs si es fa servir) (nomÈs lectura)</tooltip>
      <tooltip xml:lang="de">The decoder product number (if used) (read only)</tooltip>
    </display>
  </column>
</pane>
